id,source,feed_name,title,url,published_date,summary,matched_keywords,scraped_at
634fb005045e,News,ksl_news,Annual 100-mile walk raises suicide prevention awareness,https://www.ksl.com/article/news/utah/counties/tooele/annual-100-mile-walk-raises-suicide-prevention-awareness/51488526,,"The 11th annual Life's Worth Living 100 Mile Anti-Suicide Walk began Friday morning in Tooele, bringing together participants to raise awareness for mental health and suicide prevention.",Tooele,2026-04-25T17:25:03.193900+00:00
ea513e3301a5,News,r/Utah,Craig Swapp & Associates Breaking Federal Law for Google Reviews,https://www.reddit.com/r/Utah/comments/1su4tgo/craig_swapp_associates_breaking_federal_law_for/,2026-04-24,"<!-- SC_OFF --><div class=""md""><p>See page 19 of the attached. They received a letter for suing employees $50 to get a review, encouraging family and friends who did not use their services to leave a 5 star review, and for asking for reviews at a community event from people that hadn't used their services. </p> </div><!-- SC_ON --> &#32; submitted by &#32; <a href=""https://www.reddit.com/user/LowCommercial4827""> /u/LowCommercial4827 </a> <br /> <span><a href=""https://storage.ghost.io/c/03/80/038",commercial,2026-04-25T17:25:03.193900+00:00
b12a5db86b51,News,r/SaltLakeCity,Missing package in Downtown.,https://www.reddit.com/r/SaltLakeCity/comments/1sveswk/missing_package_in_downtown/,2026-04-25,"<table> <tr><td> <a href=""https://www.reddit.com/r/SaltLakeCity/comments/1sveswk/missing_package_in_downtown/""> <img alt=""Missing package in Downtown."" src=""https://preview.redd.it/qoyq9m0trcxg1.jpeg?width=640&amp;crop=smart&amp;auto=webp&amp;s=cc917fbb1116edf89c31648825be02a998594ab7"" title=""Missing package in Downtown."" /> </a> </td><td> <!-- SC_OFF --><div class=""md""><p>Hey SLC friends, we've just moved to the Zephyr on 360 W 200 S , and today an Amazon delivery driver drop out baby formula i",Amazon,2026-04-25T17:25:03.193900+00:00
92b1d6a693f9,News,r/SaltLakeCity,Caffeine limit in drinks?,https://www.reddit.com/r/SaltLakeCity/comments/1sugq49/caffeine_limit_in_drinks/,2026-04-24,"<!-- SC_OFF --><div class=""md""><p>I went to swig yesterday to try and finish up the gift card I got as a gift. I ordered the “mountain man” in my 44oz refillable mug. They brought my drink out and it was barely half full. I naturally asked them to fill it the rest of the way because it was $6 for a soda, but apparently there is an energy drink in it (apparently reading isn’t one of my strengths) and they claim they “can’t serve that much caffeine in a drink according to the state”. </p> <p>Has a",Erda,2026-04-25T17:25:03.193900+00:00
196fee7ba658,News,r/tooele,Stallion Drama!,https://www.reddit.com/r/Tooele/comments/1sfh463/stallion_drama/,2026-04-08,"<!-- SC_OFF --><div class=""md""><p>Please come see Disney’s “Dare To Dream”! This is a charming show with many songs you know and love! Featuring a darling teen- she strives to find her dream- even when it’s hard. The lead is played by Riley Jenkins- a freshman at Stansbury High- looking to make herself known and debut her talent! She’s just adorable! The production is May 18-19 at 7:30! Come see it before it’s gone! Tickets &gt;$10!! Perfect show for families and kids! We’d love to see you there",Tooele|Stansbury,2026-04-25T17:25:03.193900+00:00
48adb9d63276,News,r/tooele,Best places to camp if I want to forage for native plants?,https://www.reddit.com/r/Tooele/comments/1s4krfo/best_places_to_camp_if_i_want_to_forage_for/,2026-03-26,"<!-- SC_OFF --><div class=""md""><p>My mother and I are planning on taking a drive down through the valley soon to do some camping. Since I’ve recently taken up a huge obsession with Utah natives, I’ve been wanting to go track down a couple of things. Are there any good sites within driving distance of the main city?</p> </div><!-- SC_ON --> &#32; submitted by &#32; <a href=""https://www.reddit.com/user/deadinsalem""> /u/deadinsalem </a> <br /> <span><a href=""https://www.reddit.com/r/Tooele/comments",Tooele,2026-04-25T17:25:03.193900+00:00
